MRUS,31 30 253 8800,"Merus N.V., a clinical-stage immuno-oncology company, engages in the development of antibody therapeutics in the Netherlands. Its bispecific antibody candidate pipeline includes Zenocutuzumab (MCLA-128), which is in a phase 2 clinical trials for the treatment of patients with metastatic breast cancer and castration-resistant prostate cancer, as well as in Phase 1/2 clinical trials for the treatment of solid tumors that harbor Neuregulin 1. The company is also developing MCLA-158, which is in a phase I clinical trial for the treatment of solid tumors; MCLA-145, which is in phase 1 clinical trials for the treatment of solid tumors; MCLA-129, which is in phase 1/2 clinical trials for the treatment of patients with advanced non-small cell lung cancer and other solid tumors; and ONO-4685 that is Phase 1 clinical trial to treat relapsed/refractory T cell lymphoma. In addition, it has collaboration agreement with Betta Pharmaceuticals Co. Ltd for the research and development of stage bispecific antibody candidates include MCLA-129; collaboration with Incyte Corporation for the development of MCLA-145; and collaboration with Gilead Sciences, Inc. to discover novel antibody-based trispecific T-cell engagers. The company was incorporated in 2003 and is headquartered in Utrecht, the Netherlands.",86400,2,40.57,40.61,40.61,42,40.57,40.61,40.61,42,,237611,237611,616377,504650,504650,41.42,41.81,100,400,,35.67,61.61,42.6207,49.046326,,USD,,,,,,NGM,EQUITY,MRUS,MRUS,Merus N.V.,Merus N.V.,1463664600,America/New_York,EST,42321671-9233-3f73-a2ee-487472589127,finmb_24929296,-18000000,,Uppsalalaan 17,3rd & 4th floor,Utrecht,,3584,Netherlands,https://www.merus.nl,Biotechnology,biotechnology,Biotechnology,Healthcare,healthcare,Healthcare,"[{'maxAge': 1, 'name': 'Dr. Sven Ante Lundberg M.D.', 'age': 61, 'title': 'CEO, President & Executive Director', 'yearBorn': 1963, 'fiscalYear': 2023, 'totalPay': 1114527, 'exercisedValue': 0, 'unexercisedValue': 10252539}, {'maxAge': 1, 'name': 'Mr. Gregory D. Perry', 'age': 64, 'title': 'Chief Financial Officer', 'yearBorn': 1960, 'fiscalYear': 2023, 'totalPay': 419102, 'exercisedValue': 0, 'unexercisedValue': 801494}, {'maxAge': 1, 'name': 'Mr. Peter B. Silverman J.D.', 'age': 46, 'title': 'EVP, Company Secretary, COO, General Counsel, Chief Intellectual Property Officer & Head of US Legal', 'yearBorn': 1978, 'fiscalYear': 2023, 'totalPay': 781842, 'exercisedValue': 565022, 'unexercisedValue': 1331558}, {'maxAge': 1, 'name': 'Dr. Hennie  Hoogenboom', 'title': 'Co-Founder and Scientific Advisor', 'fiscalYear': 2023, 'exercisedValue': 0, 'unexercisedValue': 0}, {'maxAge': 1, 'name': 'Harry  Shuman', 'title': 'Chief Accounting Officer', 'fiscalYear': 2023, 'exercisedValue': 0, 'unexercisedValue': 0}, {'maxAge': 1, 'name': 'Mr. Cornelis Adriaan de Kruif Ph.D.', 'age': 59, 'title': 'CTO & Executive VP', 'yearBorn': 1965, 'fiscalYear': 2023, 'totalPay': 335733, 'exercisedValue': 0, 'unexercisedValue': 0}, {'maxAge': 1, 'name': 'Dr. Cecilia Anna Wilhelmina Geuijen Ph.D.', 'title': 'Chief Scientific Officer & Senior VP', 'fiscalYear': 2023, 'exercisedValue': 0, 'unexercisedValue': 0}, {'maxAge': 1, 'name': 'Ms. Kathleen  Farren', 'title': 'IR & Corporate Communications Officer', 'fiscalYear': 2023, 'exercisedValue': 0, 'unexercisedValue': 0}, {'maxAge': 1, 'name': 'Ms. Audrey  Bergan', 'title': 'Chief People Officer', 'fiscalYear': 2023, 'exercisedValue': 0, 'unexercisedValue': 0}, {'maxAge': 1, 'name': 'Ms. Shannon  Campbell', 'age': 58, 'title': 'Executive VP & Chief Commercial Officer', 'yearBorn': 1966, 'fiscalYear': 2023, 'exercisedValue': 0, 'unexercisedValue': 0}]",1703980800,2852197632,68463696,1.06599,69517200,10.278,4.053318,1703980800,1735603200,1727654400,-4.03,,,0.040725112,0.2000997,41.66,strong_buy,USD,172,,79.37765,2156349440,62897584,7999941,9779931,1734048000,1736899200,0.1168,0.020299999,11.43,0.1175,-244556000,60.012,,,632268032,9.235,11046000,7.944,8.321,35932000,1.571,0.584,-110148000,-155524992,0.067,-6.1359196,,,-9.439,-228456992,-0.21595,-0.44601002,-109096128,,,1.125,,,,,,,,,,,,-10.943805,-3.9,109,67,86.07143,86.5,1.25,14,,,,,,,,
CYDY,360 980 8524,"CytoDyn Inc., a clinical-stage biotechnology company, engages in the development of treatments for multiple therapeutic indications. The company is involved in the clinical development of leronlimab, a novel humanized monoclonal antibody targeting the C-C chemokine receptor type 5 receptor in the areas of COVID-19, human immunodeficiency virus (HIV), Metabolic dysfunction-associated steatohepatitis (MASH), and solid tumors in oncology, such as metastatic triple-negative breast cancer. Its leronlimab is currently under phase 2 development for the treatment of NASH, HIV- NASH, and solid tumors, as well as under pre-clinical development for the treatment of HIV-PrEP and HIV-Cure. The company was formerly known as RexRay Corporation. CytoDyn Inc. was incorporated in 2002 and is based in Vancouver, Washington.",86400,4,0.2095,0.22,0.2,0.22,0.2095,0.22,0.2,0.22,,1800157,1800157,3015306,6377070,6377070,0.2175,0.215,317000,,,0.1,0.32,0.1432,0.14645,,USD,,,,,,OQB,EQUITY,CYDY,CYDY,CytoDyn Inc.,CytoDyn Inc.,1166020200,America/New_York,EST,b264fe39-7e85-3dca-b7e0-99a5207f5fa1,finmb_10039157,-18000000,,1111 Main Street,Suite 660,Vancouver,WA,98660,United States,https://www.cytodyn.com,Biotechnology,biotechnology,Biotechnology,Healthcare,healthcare,Healthcare,"[{'maxAge': 1, 'name': 'Dr. Jacob P. Lalezari M.D.', 'age': 64, 'title': 'CEO & Member of Scientific Advisory Board', 'yearBorn': 1960, 'fiscalYear': 2024, 'totalPay': 356061, 'exercisedValue': 0, 'unexercisedValue': 0}, {'maxAge': 1, 'name': 'Mr. Mitchell M. Cohen', 'age': 68, 'title': 'Interim Chief Financial Officer', 'yearBorn': 1956, 'fiscalYear': 2024, 'totalPay': 655200, 'exercisedValue': 0, 'unexercisedValue': 0}, {'maxAge': 1, 'name': 'Mr. Tyler  Blok', 'age': 37, 'title': 'Chief Legal Officer & Corporate Secretary', 'yearBorn': 1987, 'fiscalYear': 2024, 'totalPay': 399773, 'exercisedValue': 0, 'unexercisedValue': 0}, {'maxAge': 1, 'name': 'Dr. Cyrus  Arman M.B.A., Ph.D.', 'age': 43, 'title': 'Senior Vice President of Business Operations', 'yearBorn': 1981, 'fiscalYear': 2024, 'totalPay': 278100, 'exercisedValue': 0, 'unexercisedValue': 0}, {'maxAge': 1, 'name': 'Dr. Bernie  Cunningham P.M.P., Ph.D.', 'title': 'Vice President of Operations', 'fiscalYear': 2024, 'exercisedValue': 0, 'unexercisedValue': 0}, {'maxAge': 1, 'name': 'Dr. Scott  Hansen Ph.D.', 'title': 'Head of Research & Basic Science', 'fiscalYear': 2024, 'exercisedValue': 0, 'unexercisedValue': 0}, {'maxAge': 1, 'name': 'Dr. Max  Lataillade D.O., M.P.H.', 'title': 'Senior VP & Head of Clinical Development', 'fiscalYear': 2024, 'exercisedValue': 0, 'unexercisedValue': 0}, {'maxAge': 1, 'name': 'Ms. Cristina  De Leon', 'title': 'Investors', 'fiscalYear': 2024, 'exercisedValue': 0, 'unexercisedValue': 0}]",1735603200,263578160,1228230016,0.21406001,1228230016,-0.11,,1717113600,1748649600,1732924800,-0.02,,,0.25,0.2000997,0.2146,none,USD,9,,,,,,,,,,5.50817,,,,,,,,,,,,,,,,,,,360 799 5954,,,,,,,,,,,,,,,,,,,,,-1.1922221,-0.18,,,,,,,,,,,,,,
SDHC,770 213 8067,"Smith Douglas Homes Corp., together with its subsidiaries, engages in the design, construction, and sale of single-family homes in the southeastern United States. It also provides closing, escrow, and title insurance services. The company sells its products to entry-level and empty-nest homebuyers. Smith Douglas Homes Corp. was founded in 2008 and is headquartered in Woodstock, Georgia.",86400,2,23.52,23.38,22.5859,23.7,23.52,23.38,22.5859,23.7,12.382979,49799,49799,99601,69530,69530,22.04,26.68,3000,900,,20.55,39.5,28.194,30.17095,,USD,,,,,,NYQ,EQUITY,SDHC,SDHC,Smith Douglas Homes Corp.,Smith Douglas Homes Corp.,1705415400,America/New_York,EST,d1a3d02b-8741-3369-bc5b-9ef9f28724ba,finmb_328847166,-18000000,,110 Village Trail,Suite 215,Woodstock,GA,30188,United States,https://smithdouglas.com,Real Estate - Development,real-estate-development,Real Estate - Development,Real Estate,real-estate,Real Estate,"[{'maxAge': 1, 'name': 'Mr. Thomas L. Bradbury', 'age': 79, 'title': 'Founder & Executive Chairman', 'yearBorn': 1945, 'fiscalYear': 2023, 'exercisedValue': 0, 'unexercisedValue': 0}, {'maxAge': 1, 'name': 'Mr. Gregory S. Bennett', 'age': 58, 'title': 'President, CEO & Vice Chairman', 'yearBorn': 1966, 'fiscalYear': 2023, 'totalPay': 2091703, 'exercisedValue': 0, 'unexercisedValue': 0}, {'maxAge': 1, 'name': 'Mr. Russell  Devendorf', 'age': 51, 'title': 'Executive VP & CFO', 'yearBorn': 1973, 'fiscalYear': 2023, 'totalPay': 1853187, 'exercisedValue': 0, 'unexercisedValue': 0}, {'maxAge': 1, 'name': 'Mr. Brett A. Steele', 'age': 53, 'title': 'VP, General Counsel & Secretary', 'yearBorn': 1971, 'fiscalYear': 2023, 'totalPay': 544955, 'exercisedValue': 0, 'unexercisedValue': 0}, {'maxAge': 1, 'name': 'Mr. Geoff  Shrewsbury', 'title': 'Vice President of Operations', 'fiscalYear': 2023, 'exercisedValue': 0, 'unexercisedValue': 0}, {'maxAge': 1, 'name': 'Mr. Jim  VanKirk', 'title': 'Executive Vice President of Sales & Marketing', 'fiscalYear': 2023, 'exercisedValue': 0, 'unexercisedValue': 0}, {'maxAge': 1, 'name': 'Ms. Katie  Peacocke', 'title': 'Vice President of Human Resources', 'fiscalYear': 2023, 'exercisedValue': 0, 'unexercisedValue': 0}, {'maxAge': 1, 'name': 'Mr. Joe  Thomas', 'title': 'SVP of Accounting & Finance', 'fiscalYear': 2023, 'exercisedValue': 0, 'unexercisedValue': 0}, {'maxAge': 1, 'name': 'Mr. Eddy  Kleid', 'title': 'President of Central Georgia Division', 'fiscalYear': 2023, 'exercisedValue': 0, 'unexercisedValue': 0}, {'maxAge': 1, 'name': 'Ms. Teresa  Carlile', 'title': 'President of Ridgeland Mortgage', 'fiscalYear': 2023, 'exercisedValue': 0, 'unexercisedValue': 0}]",1703980800,1193847296,8846150,1.13253,51282100,7.736,3.0093071,1703980800,1735603200,1727654400,1.88,,,-0.15929204,0.2000997,23.28,hold,USD,364,,1.3187253,491733536,8841112,457836,516770,1734048000,1736899200,0.0089,0.03844,2.73,0.0701,41645000,0.543,,,23716000,2.681,3463000,0.418,5.385,905304000,0.93,102.339,240219008,34954000,0.406,0.14238,,0.046,4.086,120351000,0.18834999,0.40248,50605624,0.26534998,0.13294,,,,,,,,,,,,,13.241945,2.1,35,20,25.2,24,3.16667,5,,,,,,,-0.842,-0.998
BLIN,781 376 5555,"Bridgeline Digital, Inc. operates as a marketing technology company in the United States, Canada, and internationally. The company offers HawkSearch, a site search, recommendation, and personalization application for marketers, merchandisers, and developers; Celebros Search, a commerce-oriented site search product that provides natural language processing with artificial intelligence; and Woorank, a Search Engine Optimization (SEO) audit tool that generates an instant performance audit of the site's technical, on-page, and off-page SEO. It also provides Bridgeline TruPresence, a web content management and eCommerce platform to support the needs of multi-unit organizations and franchises; Bridgeline Unbound, a technology suite that empower marketers to easily manage their digital experiences and create personalized customer journeys; and OrchestraCMS, a digital experience platform that enables development of custom solutions, third-party integrations, and delivery of digital transformation initiatives on the Salesforce platform. In addition, the company offers digital engagement services comprising digital strategy, web design and web development, usability engineering, information architecture, and SEO, as well as hosting services. It serves vertical markets, such as industrial distributors and wholesalers, franchises and enterprises, manufacturers, eCommerce retailers, health services and life sciences, technology, credit unions and banks, and associations and foundations through its direct sales force. The company was formerly known as Bridgeline Software, Inc. Bridgeline Digital, Inc. was incorporated in 2000 and is based in Woburn, Massachusetts.",86400,4,1.97,2,1.8501,2,1.97,2,1.8501,2,,82680,82680,205579,142940,142940,1.85,1.88,100,100,,0.75,2.8,1.5254,1.18385,,USD,,,,,,NCM,EQUITY,BLIN,BLIN,"Bridgeline Digital, Inc.","Bridgeline Digital, Inc.",1183123800,America/New_York,EST,5092da9e-fb38-33f4-85af-5d4bed18b290,finmb_7682403,-18000000,,100 Sylvan Road,Suite G700,Woburn,MA,1801,United States,https://www.bridgeline.com,Software - Infrastructure,software-infrastructure,Software - Infrastructure,Technology,technology,Technology,"[{'maxAge': 1, 'name': 'Mr. Roger E. Kahn Ph.D.', 'age': 54, 'title': 'President, CEO & Director', 'yearBorn': 1969, 'fiscalYear': 2023, 'totalPay': 585949, 'exercisedValue': 0, 'unexercisedValue': 0}, {'maxAge': 1, 'name': 'Mr. Thomas R. Windhausen CPA', 'age': 44, 'title': 'CFO, Treasurer & Secretary', 'yearBorn': 1979, 'fiscalYear': 2023, 'totalPay': 308723, 'exercisedValue': 0, 'unexercisedValue': 0}, {'maxAge': 1, 'name': 'Ms. Danielle  Colvin', 'title': 'Senior Vice President of Marketing', 'fiscalYear': 2023, 'exercisedValue': 0, 'unexercisedValue': 0}, {'maxAge': 1, 'name': 'Mr. Carl  Prizzi', 'title': 'Executive Vice President of Revenue', 'fiscalYear': 2023, 'exercisedValue': 0, 'unexercisedValue': 0}, {'maxAge': 1, 'name': 'Mr. Jeremy  LaDuque', 'title': 'Senior Vice President of Partnerships', 'fiscalYear': 2023, 'exercisedValue': 0, 'unexercisedValue': 0}, {'maxAge': 1, 'name': 'Mr. John  Murcott', 'title': 'Executive Vice President of Product & Strategy', 'fiscalYear': 2023, 'exercisedValue': 0, 'unexercisedValue': 0}]",1703980800,20314320,10417600,0.03783,10417600,0.992,1.9657259,1696032000,1727654400,1719705600,-0.19,1:50,1556755200,1.5802469,0.2000997,1.95,none,USD,55,,1.3283411,15131237,8509624,27112,109742,1730332800,1732838400,0.0026,0.19489999,0.67,0.0029,-9592000,0.989,,,1200000,0.115,728000,0.593,0.665,15293000,6.987,1.468,10374000,-1054000,0.007,-0.08384,,-0.62722,-14.691,-1030000,-0.06935,-0.63918996,-210875,0.67835,-0.06735,1.961,,,,,,,,,,,,27.857143,-0.15,3,3,3,3,,1,,,,,,,,
YQQQ,,,86400,2,16.72,16.73,16.65,16.809,16.72,16.73,16.65,16.809,,10001,10001,28549,30430,30430,12.02,21.41,200,200,,16.32,20.55,17.30278,18.219229,,USD,,,,,,NGM,EQUITY,YQQQ,YQQQ,YieldMax Short N100 Option Inco,YieldMax Short N100 Option Income Strategy ETF,1723728600,America/New_York,EST,764fd765-9543-39a0-85cb-dc795fa6986e,finmb_1870567487,-18000000,,,,,,,,,,,,,,,,,,,,,,,,,,,,,,,,,,,,,,,,,,,,,,,,,,,,,,,,,,,,,,,,,,,,,,,,,,,,,,,,,,,,,,,,,,,,,,,,,,,
PRKS,407 226 5011,"United Parks & Resorts Inc., together with its subsidiaries, operates as a theme park and entertainment company in the United States. It operates and licenses SeaWorld theme parks in Orlando, Florida; San Antonio, Texas; Abu Dhabi, United Arab Emirates; and San Diego, California, as well as Busch Gardens theme parks in Tampa, Florida, and Williamsburg, Virginia. The company also operates water park attractions in Orlando, Florida; San Antonio, Texas; San Diego, California; Chula Vista, California; Tampa, Florida; and Williamsburg, Virginia. In addition, the company operates a reservations-only theme park in Orlando, Florida and a park in Langhorne, Pennsylvania; and theme park in Chula Vista, California. It operates a portfolio of theme parks under the SeaWorld, Busch Gardens, Aquatica, Discovery Cove, Water Country USA, Adventure Island, and Sesame Place brand name. The company was formerly known as SeaWorld Entertainment, Inc. and changed its name to United Parks & Resorts Inc. in February 2024. SeaWorld Entertainment, Inc. was founded in 1959 and is headquartered in Orlando, Florida.",86400,2,52.81,52.7,52.55,52.97,52.81,52.7,52.55,52.97,13.598447,393656,393656,797886,1045140,1045140,52.67,53.79,1000,1000,,44.72,60.83,55.6638,52.8985,,USD,,,,,,NYQ,EQUITY,PRKS,PRKS,United Parks & Resorts Inc.,United Parks & Resorts Inc.,1366378200,America/New_York,EST,cd5a6fed-0287-33f3-aac5-2a95571b2abe,finmb_864032,-18000000,,6240 Sea Harbor Drive,,Orlando,FL,32821,United States,https://www.unitedparks.com,Leisure,leisure,Leisure,Consumer Cyclical,consumer-cyclical,Consumer Cyclical,"[{'maxAge': 1, 'name': 'Mr. Marc G. Swanson CPA', 'age': 53, 'title': 'Chief Executive Officer', 'yearBorn': 1971, 'fiscalYear': 2023, 'totalPay': 498334, 'exercisedValue': 0, 'unexercisedValue': 13180}, {'maxAge': 1, 'name': 'Mr. Kyle R. Miller', 'age': 47, 'title': 'Co-Chief Parks Operation Officer', 'yearBorn': 1977, 'fiscalYear': 2023, 'totalPay': 283833, 'exercisedValue': 422553, 'unexercisedValue': 1446}, {'maxAge': 1, 'name': 'Mr. Byron  Surrett', 'age': 65, 'title': 'Chief Parks Operations Officer \x96 Non-Florida Parks', 'yearBorn': 1959, 'fiscalYear': 2023, 'totalPay': 269151, 'exercisedValue': 0, 'unexercisedValue': 137902}, {'maxAge': 1, 'name': 'Mr. James Edward Mikolaichik CPA, CPA', 'age': 53, 'title': 'CFO & Treasurer', 'yearBorn': 1971, 'fiscalYear': 2023, 'exercisedValue': 0, 'unexercisedValue': 0}, {'maxAge': 1, 'name': 'Mr. William E. Myers II', 'age': 57, 'title': 'Chief Accounting Officer', 'yearBorn': 1967, 'fiscalYear': 2023, 'exercisedValue': 0, 'unexercisedValue': 0}, {'maxAge': 1, 'name': 'Mr. Matthew V. Stroud', 'age': 59, 'title': 'Vice President of Investor Relations', 'yearBorn': 1965, 'fiscalYear': 2023, 'exercisedValue': 0, 'unexercisedValue': 0}, {'maxAge': 1, 'name': 'Mr. George Anthony Taylor Esq.', 'age': 59, 'title': 'Chief Legal Officer, General Counsel & Corporate Secretary', 'yearBorn': 1965, 'fiscalYear': 2023, 'totalPay': 403908, 'exercisedValue': 0, 'unexercisedValue': 1990740}, {'maxAge': 1, 'name': 'Mr. Michael  Rady', 'title': 'Chief Human Resources Officer', 'fiscalYear': 2023, 'exercisedValue': 0, 'unexercisedValue': 0}, {'maxAge': 1, 'name': 'Dr. Christopher M. Dold DVM', 'age': 51, 'title': 'Chief Zoological Officer', 'yearBorn': 1973, 'fiscalYear': 2023, 'totalPay': 335622, 'exercisedValue': 0, 'unexercisedValue': 152218}, {'maxAge': 1, 'name': 'Mr. Mike  Denninger', 'title': 'Senior Vice President of Attractions', 'fiscalYear': 2023, 'exercisedValue': 0, 'unexercisedValue': 0}]",1703980800,2887133696,55003500,1.29981,55003500,-8.175,,1703980800,1735603200,1727654400,3.86,,,0.10619652,0.2000997,52.49,buy,USD,3300,1474934400,1.6689773,5198392320,27162383,6183763,6123772,1734048000,1736899200,0.112399995,0.01997,9.04,0.22719999,239652992,3.005,0.1,1474934400,76835000,1.397,2370491904,0.41,0.643,1729881984,,28.002,883556992,474129984,-0.004,0.36819,,0.13854,7.724,673033024,0.124630004,,81181128,0.51076,0.38906,2.006,,,,,,,,,,,,11.250115,4.56,70,43,61.3,62.5,2.2,10,5,3,4,4,3,1738368000,-0.031,0.083
TIOAW,,,,,,,,,,,,,,,,,,,,,,,,,,,,,,,,,,,,,,,,,,,,,,,,,,,,,,,,,,,,,,,,,,,,,,,,,,,,,,,,,,,,,,,,,,,,,,,,,,,,,,,,,,,,,,,,,,,,,,,,,,,,,,,,,,,,,,,,,,,,,,,,,
STG,86 10 5241 3738,"Sunlands Technology Group provides online education services through online and mobile platforms in the People's Republic of China. It offers adult online education and adult personal interest learning education through courses and educational content offerings, including interest, professional skills and professional certification preparation courses, and degree- or diploma-oriented post-secondary courses. The company provides professional assistance and counseling services to help students make decisions that suit their learning needs and to formulate study plans throughout their enrollments in the courses; and exam preparation courses for exam-taking students. In addition, the company offers degree- or diploma-oriented post-secondary course that consist of preparation courses for a state-administered exam for learners pursuing associate diplomas or bachelor's degrees, and other degree- or diploma-oriented post-secondary courses. Further, it provides professional certification preparation courses cover various industries and professions, such as accounting, human resources, and teaching, as well as technical and consultation services. The company was formerly known as Sunlands Online Education Group and changed its name to Sunlands Technology Group in August 2018. Sunlands Technology Group was founded in 2003 and is headquartered in Beijing, the People's Republic of China.",86400,2,6.5695,6.51,6.6,6.77,6.5695,6.51,6.6,6.77,1.5044944,2308,2308,8391,15750,15750,6.51,6.79,1300,1400,,4.25,12.55,6.20914,7.28946,,USD,,,,,,NYQ,EQUITY,STG,STG,Sunlands Technology Group,Sunlands Technology Group,1521811800,America/New_York,EST,c5d69b6a-6279-3d83-8923-40fa62fcf56c,finmb_551782243,-18000000,,Building 6,"Chaolai Science Park No. 36, Chuangyuan Road Chaoyang District",Beijing,,100012,China,https://www.sunlands.com,Education & Training Services,education-training-services,Education & Training Services,Consumer Defensive,consumer-defensive,Consumer Defensive,"[{'maxAge': 1, 'name': 'Mr. Peng  Ou', 'age': 45, 'title': 'Founder & Chairman of the Board of Directors', 'yearBorn': 1978, 'exercisedValue': 0, 'unexercisedValue': 0}, {'maxAge': 1, 'name': 'Mr. Tongbo  Liu', 'age': 36, 'title': 'CEO & Director', 'yearBorn': 1987, 'exercisedValue': 0, 'unexercisedValue': 0}, {'maxAge': 1, 'name': 'Mr. Hangyu  Li', 'age': 40, 'title': 'Finance Director', 'yearBorn': 1983, 'exercisedValue': 0, 'unexercisedValue': 0}, {'maxAge': 1, 'name': 'Mr. Zheng  Du', 'age': 39, 'title': 'Chief Operating Officer', 'yearBorn': 1984, 'exercisedValue': 0, 'unexercisedValue': 0}, {'maxAge': 1, 'name': 'Daisy  Wang', 'title': 'Head of Investor Relations', 'exercisedValue': 0, 'unexercisedValue': 0}, {'maxAge': 1, 'name': 'Ms. Jing  Gao', 'age': 38, 'title': 'VP of Risk Control Department & Director', 'yearBorn': 1985, 'exercisedValue': 0, 'unexercisedValue': 0}, {'maxAge': 1, 'name': 'Ms. Yingying  Liu', 'title': 'Investor Relations Director', 'exercisedValue': 0, 'unexercisedValue': 0}]",,91665936,5374780,0.00062,13691700,20.189,0.33161625,1703980800,1735603200,1719705600,4.45,0.402777778,1630368000,-0.21071011,0.2000997,6.695,none,CNY,2113,1656460800,0.044031676,-668112448,416433,21665,25083,1727654400,1730332800,0.0016,0.07642,1.21,0.0069,481828000,-0.321,,,997417024,145.697,285608992,1.111,1.258,2081817984,59.253,151.626,1790146048,,-0.065,0.15576,,0.23145,-1.5,445327008,0.12354,2.00158,,0.8599,0.21391001,1.125,,,,,,,,,,,,-15.940477,-0.42,,,,,,,,,,,,,-0.527,-0.522
